{
  "kind": "tasktra.transition-approval",
  "version": 1,
  "approval_id": "stage-3-work-complete",
  "goal_id": "tasktra-1-0",
  "work_unit_id": "stage-3-durable-autonomy",
  "action": "work-complete",
  "effect": "local-reversible-write",
  "scope": {
    "paths": ["."],
    "exclusions": []
  },
  "envelope_sha256": "5da4d6f1677787c638a2934ae08fa1d8caff8beab785499d0b31a5539f8163cd",
  "decision": "approved",
  "approver": {
    "kind": "steward",
    "id": "goal-steward"
  },
  "performer_id": "tasktra-coordinator",
  "authority_clause": "Completion is allowed only after the Stage 2 workflow gate and Stage 3 independent acceptance evidence pass.",
  "evidence": [
    "stage-three-checklist"
  ],
  "valid_until": "2027-09-19T23:59:59Z",
  "revoked_at": null
}
