{
  "kind": "tasktra.transition-approval",
  "version": 1,
  "approval_id": "stage-7-local-effect-segmented",
  "goal_id": "tasktra-1-0",
  "work_unit_id": "stage-7-operations-release",
  "action": "local-effect",
  "effect": "local-reversible-write",
  "scope": {
    "paths": ["."],
    "exclusions": []
  },
  "envelope_sha256": "5da4d6f1677787c638a2934ae08fa1d8caff8beab785499d0b31a5539f8163cd",
  "decision": "approved",
  "approver": {
    "kind": "steward",
    "id": "goal-steward"
  },
  "performer_id": "tasktra-coordinator",
  "authority_clause": "Stage 7 may apply only the local, network-free upgrade plan with SHA-256 2da1f95e532f68dc54e8a11ca206f8785847541d195ae048016b55e433de423c, using its exact segmented validation plan, runtime backup, and effect receipt. No remote, deployment, history, communication, or destructive effect is authorized.",
  "evidence": [
    "stage-seven-segmented-preview",
    "stage-seven-full-suite"
  ],
  "valid_until": "2027-09-19T23:59:59Z",
  "revoked_at": null
}
